{
  "schema_version": "cmb.global-ai-watch.v1",
  "generated_at": null,
  "source": {
    "name": "GDELT Project DOC 2.0 API",
    "endpoint": "https://api.gdeltproject.org/api/v2/doc/doc",
    "documentation": "https://blog.gdeltproject.org/gdelt-doc-2-0-api-debuts/"
  },
  "query": "(\"artificial intelligence\" OR \"generative AI\" OR \"AI agent\" OR deepfake OR \"machine learning\") (risk OR danger OR harm OR hallucination OR fraud OR scam OR surveillance OR military OR weapon OR autonomous OR bias OR privacy OR misinformation OR disinformation)",
  "timespan": "24h",
  "article_count": 0,
  "domain_count": 0,
  "country_count": 0,
  "interpretation_boundaries": [
    "GDELT_DISCOVERY != INDEPENDENT_CONFIRMATION",
    "HEADLINE_SIMILARITY != FACT_CORROBORATION",
    "NEWS_REPORT != PROOF_OF_CMB",
    "CMB_TAG != SOURCE_ENDORSEMENT",
    "PATTERN != PROOF",
    "HUMAN_AGENCY > MACHINE_AUTHORITY"
  ],
  "articles": []
}
